{
  "negotiationId": "12345",
  "topic": {
    "title": "Renegotiating a Supply Contract",
    "description": "The first party wants to renegotiate the terms of their current supply contract with the second party due to changes in market conditions and increasing competition.",
    "context": "The two companies have a long-standing relationship and have successfully collaborated on multiple projects. However, the first party feels that they are being taken advantage of by the second party's rising costs.",
    "industry": "Manufacturing",
    "expectedTimeframe": "3-6 months"
  },
  "parties": [
    {
      "id": "party1",
      "name": "NovaTech Inc.",
      "role": "Buyer",
      "interests": [
        "Cost reduction",
        "Increased market share"
      ],
      "constraints": [
        "Limited financial resources",
        "Dependence on supplier"
      ],
      "authorityLevel": "full"
    },
    {
      "id": "party2",
      "name": "Apex Manufacturing Co.",
      "role": "Seller",
      "interests": [
        "Higher profit margins",
        "Long-term partnership"
      ],
      "constraints": [
        "Increasing production costs",
        "Limited capacity for new contracts"
      ],
      "authorityLevel": "full"
    }
  ],
  "conflictPoints": [
    {
      "id": "conflict1",
      "description": "The current contract price is too high, and the first party wants a reduction.",
      "severity": "medium",
      "impact": "Potential loss of business if not renegotiated.",
      "relatedPoints": [
        "Supplier's increasing costs",
        "Market competition"
      ]
    }
  ],
  "negotiablePoints": [
    {
      "id": "point1",
      "topic": "Contract price reduction",
      "currentPosition": {
        "party1Position": "10% discount from current price",
        "party2Position": "5% increase in price"
      },
      "acceptableRange": {
        "minimum": "-15%",
        "maximum": "5%",
        "preferredOutcome": "-5%"
      },
      "priority": "high",
      "flexibility": "moderate"
    }
  ],
  "nonNegotiablePoints": [
    {
      "id": "nonNeg1",
      "description": "The length of the contract cannot be increased beyond its current term.",
      "rationale": "Both parties have agreed on a fixed-term contract, and extending it would require significant changes to the agreement.",
      "impact": "Potential impact on future business opportunities"
    }
  ],
  "walkawayConditions": {
    "party1Conditions": [
      {
        "condition": "Contract price below 80% of current value",
        "threshold": "0.8",
        "reasoning": "If the second party agrees to a contract price lower than 80%, NovaTech Inc. will consider terminating the contract."
      }
    ],
    "party2Conditions": [
      {
        "condition": "Price reduction above 15%",
        "threshold": "0.15",
        "reasoning": "Apex Manufacturing Co. will reconsider its position if the first party demands a price reduction of more than 15%."
      }
    ]
  },
  "strategies": {
    "overallApproach": "collaborative",
    "longTermObjectives": [
      {
        "objective": "Establish a long-term partnership with Apex Manufacturing Co.",
        "importance": "high",
        "timeframe": "5-7 years"
      }
    ],
    "relationshipGoals": {
      "desiredOutcome": "strengthen",
      "futureInteractions": "Regular business meetings and open communication"
    }
  },
  "tactics": {
    "openingApproach": {
      "initialOffer": "Starting with a 5% price reduction offer to gauge Apex Manufacturing Co.'s response.",
      "anchoringStrategy": "Using the initial offer as a basis for further negotiations."
    },
    "concessionPlan": {
      "sequence": [
        {
          "stage": "Initial negotiation phase",
          "possibleConcessions": [
            "Additional discounts",
            "Extended contract term"
          ],
          "triggerConditions": [
            "Apex Manufacturing Co.'s response to the initial offer"
          ]
        }
      ],
      "pacing": "Gradual, with a focus on finding a mutually beneficial solution."
    },
    "persuasionTechniques": [
      {
        "technique": "reciprocity",
        "applicationContext": "Highlighting Apex Manufacturing Co.'s benefits from the proposed price reduction.",
        "fallbackOptions": [
          "Using social proof"
        ]
      }
    ],
    "informationGathering": {
      "keyQuestions": [
        "What are Apex Manufacturing Co.'s production costs?",
        "How does the company plan to address market competition?"
      ],
      "observationFocus": [
        "Monitoring Apex Manufacturing Co.'s pricing strategy and production capacity"
      ]
    },
    "deadlockBreakers": [
      {
        "approach": "Offering additional incentives for a long-term contract",
        "conditions": "If negotiations stall, consider offering exclusive rights to supply NovaTech Inc. with specific materials.",
        "risks": "Potential impact on future business opportunities if Apex Manufacturing Co. feels pressured into concessions."
      }
    ]
  }
}